"id";"name";"dob";"email";"phone_number";"isMale";"interestedIn";"skillInterest";"int1";"int2";"int3";"bio";"firebaseId";"formCompleted";"createdAt";"updatedAt"
1;"Billy Bob";"1987-08-09 11:05:02";"billy.bob@example.com";"1393900954";1;0;"Backend";"Sleep";"Video Games";"Movies";"Vehicula ipsum a arcu cursus vitae congue mauris rhoncus aenean vel elit scelerisque mauris pellentesque pulvinar pellentesque habitant morbi tristique senectus et netus et malesuada fames ac turpis egestas maecenas pharetra convallis posuere morbi leo urna molestie at elementum eu facilisis sed odio morbi quis commodo odio aenean sed adipiscing.";"";0;"2019-05-27 19:43:41";"2019-05-27 19:43:41"
2;"Jane Doe";"1989-11-09 14:05:02";"jane.doe@example.com";"1590097039";0;1;"Backend";"Dancing";"Books";"Movies";"Tellus molestie nunc non blandit massa enim nec dui nunc mattis enim ut tellus elementum sagittis vitae et leo duis ut diam quam nulla porttitor massa id neque aliquam vestibulum morbi blandit cursus risus at ultrices mi tempus imperdiet nulla malesuada pellentesque elit eget gravida cum sociis natoque penatibus et.";"";0;"2019-05-27 19:43:41";"2019-05-27 19:43:41"
3;"John Doe";"1991-01-09 13:05:02";"john.doe@example.com";"1338600765";1;0;"Backend";"Dancing";"Books";"Movies";"Tellus molestie nunc non blandit massa enim nec dui nunc mattis enim ut tellus elementum sagittis vitae et leo duis ut diam quam nulla porttitor massa id neque aliquam vestibulum morbi blandit cursus risus at ultrices mi tempus imperdiet nulla malesuada pellentesque elit eget gravida cum sociis natoque penatibus et.";"";0;"2019-05-27 19:43:41";"2019-05-27 19:43:41"
4;"Lesa Allen";"1985-01-15 13:05:02";"lesa.allen@example.com";"1559044318";0;1;"Frontend";"Eating";"Swimming";"Movies";"Ornare aenean euismod elementum nisi quis eleifend quam adipiscing vitae proin sagittis nisl rhoncus mattis rhoncus urna neque viverra justo nec ultrices dui sapien eget mi proin sed libero enim sed faucibus turpis in eu mi bibendum neque egestas congue quisque egestas diam in arcu cursus euismod quis viverra nibh.";"";0;"2019-05-27 19:43:41";"2019-05-27 19:43:41"
5;"Marvin Armstrong";"1980-01-15 13:05:02";"marvin.armstrong98@example.com";"1867093132";1;0;"Frontend";"Travelling";"Running";"Netflix";"Ornare aenean euismod elementum nisi quis eleifend quam adipiscing vitae proin sagittis nisl rhoncus mattis rhoncus urna neque viverra justo nec ultrices dui sapien eget mi proin sed libero enim sed faucibus turpis in eu mi bibendum neque egestas congue quisque egestas diam in arcu cursus euismod quis viverra nibh.";"";0;"2019-05-27 19:43:41";"2019-05-27 19:43:41"
6;"Priscilla Ortiz";"1985-11-15 17:05:02";"priscilla.ortiz63@example.com";"1461412214";0;1;"Frontend";"Dancing";"Kayaking";"Netflix";"Sit amet risus nullam eget felis eget nunc lobortis mattis aliquam faucibus purus in massa tempor nec feugiat nisl pretium fusce id velit ut tortor pretium viverra suspendisse potenti nullam ac tortor vitae purus faucibus ornare suspendisse sed nisi lacus sed viverra tellus in hac habitasse platea dictumst vestibulum rhoncus.";"";0;"2019-05-27 19:43:41";"2019-05-27 19:43:41"
7;"Ruby Burton";"1978-06-20 02:05:02";"ruby.burton54@example.com";"2021332890";0;1;"Fullstack";"Gym";"Sleeping";"Netflix";"Cras adipiscing enim eu turpis egestas pretium aenean pharetra magna ac placerat vestibulum lectus mauris ultrices eros in cursus turpis massa tincidunt dui ut ornare lectus sit amet est placerat in egestas erat imperdiet sed euismod nisi porta lorem mollis aliquam ut porttitor leo a diam sollicitudin tempor id eu.";"";0;"2019-05-27 19:43:41";"2019-05-27 19:43:41"
8;"Joan Ross";"1993-06-20 02:05:02";"joan.ross79@example.com";"1767563533";0;1;"Fullstack";"Yoga";"Jiu Jitsu";"Comics";"Morbi tempus iaculis urna id volutpat lacus laoreet non curabitur gravida arcu ac tortor dignissim convallis aenean et tortor at risus viverra adipiscing at in tellus integer feugiat scelerisque varius morbi enim nunc faucibus a pellentesque sit amet porttitor eget dolor morbi non arcu risus quis varius quam quisque id.";"";0;"2019-05-27 19:43:41";"2019-05-27 19:43:41"
9;"Wayne Rodriguez";"1973-09-20 02:05:02";"wayne.rodriguez11@example.com";"1339175098";1;0;"Fullstack";"Books";"Hiking";"Coding";"Venenatis a condimentum vitae sapien pellentesque habitant morbi tristique senectus et netus et malesuada fames ac turpis egestas sed tempus urna et pharetra pharetra massa massa ultricies mi quis hendrerit dolor magna eget est lorem ipsum dolor sit amet consectetur adipiscing elit pellentesque habitant morbi tristique senectus et netus et.";"";0;"2019-05-27 19:43:41";"2019-05-27 19:43:41"
10;"Ronnie Butler";"1996-08-20 02:05:02";"ronnie.butler99@example.com";"1611384867";1;0;"Fullstack";"Movies";"Sleeping";"Coding";"Quis varius quam quisque id diam vel quam elementum pulvinar etiam non quam lacus suspendisse faucibus interdum posuere lorem ipsum dolor sit amet consectetur adipiscing elit duis tristique sollicitudin nibh sit amet commodo nulla facilisi nullam vehicula ipsum a arcu cursus vitae congue mauris rhoncus aenean vel elit scelerisque mauris.";"";0;"2019-05-27 19:43:41";"2019-05-27 19:43:41"
11;"Curtis Day";"1992-03-11 08:05:02";"curtis.day95@example.com";"1192831547";1;0;"Frontend";"Hiking";"Dancing";"Movies";"Consequat nisl vel pretium lectus quam id leo in vitae turpis massa sed elementum tempus egestas sed sed risus pretium quam vulputate dignissim suspendisse in est ante in nibh mauris cursus mattis molestie a iaculis at erat pellentesque adipiscing commodo elit at imperdiet dui accumsan sit amet nulla facilisi morbi.";"";0;"2019-05-27 19:43:41";"2019-05-27 19:43:41"
12;"Harry Harper";"1986-08-11 08:05:02";"harry.harper61@example.com";"2141870617";1;0;"Backend";"Hockey";"Basketball";"Soccer";"Eleifend donec pretium vulputate sapien nec sagittis aliquam malesuada bibendum arcu vitae elementum curabitur vitae nunc sed velit dignissim sodales ut eu sem integer vitae justo eget magna fermentum iaculis eu non diam phasellus vestibulum lorem sed risus ultricies tristique nulla aliquet enim tortor at auctor urna nunc id cursus.";"";0;"2019-05-27 19:43:41";"2019-05-27 19:43:41"
13;"Diana Lawson";"1996-05-16 08:05:02";"diana.lawson39@example.com";"1936586981";0;1;"Backend";"Basketball";"Music";"Painting";"Imperdiet sed euismod nisi porta lorem mollis aliquam ut porttitor leo a diam sollicitudin tempor id eu nisl nunc mi ipsum faucibus vitae aliquet nec ullamcorper sit amet risus nullam eget felis eget nunc lobortis mattis aliquam faucibus purus in massa tempor nec feugiat nisl pretium fusce id velit ut.";"";0;"2019-05-27 19:43:41";"2019-05-27 19:43:41"
14;"Veronica Fletcher";"1991-03-02 13:05:02";"veronica.fletcher49@example.com";"1536075779";0;1;"Frontend";"Dancing";"Movies";"Coding";"Donec massa sapien faucibus et molestie ac feugiat sed lectus vestibulum mattis ullamcorper velit sed ullamcorper morbi tincidunt ornare massa eget egestas purus viverra accumsan in nisl nisi scelerisque eu ultrices vitae auctor eu augue ut lectus arcu bibendum at varius vel pharetra vel turpis nunc eget lorem dolor sed.";"";0;"2019-05-27 19:43:41";"2019-05-27 19:43:41"
15;"Jenny Rhodes";"1986-06-30 12:05:02";"jenny.rhodes78@example.com";"1635307923";0;1;"Backend";"Baseball";"Movies";"Food";"Viverra mauris in aliquam sem fringilla ut morbi tincidunt augue interdum velit euismod in pellentesque massa placerat duis ultricies lacus sed turpis tincidunt id aliquet risus feugiat in ante metus dictum at tempor commodo ullamcorper a lacus vestibulum sed arcu non odio euismod lacinia at quis risus sed vulputate odio.";"";0;"2019-05-27 19:43:41";"2019-05-27 19:43:41"
16;"Jessie Ruiz";"1989-06-30 12:05:02";"jessie.ruiz@example.com";"1148642373";0;1;"Fullstack";"Books";"Hiking";"Sleeping";"Vitae ultricies leo integer malesuada nunc vel risus commodo viverra maecenas accumsan lacus vel facilisis volutpat est velit egestas dui id ornare arcu odio ut sem nulla pharetra diam sit amet nisl suscipit adipiscing bibendum est ultricies integer quis auctor elit sed vulputate mi sit amet mauris commodo quis imperdiet.";"";0;"2019-05-27 19:43:41";"2019-05-27 19:43:41"
17;"Joanne Carroll";"1987-12-30 13:05:02";"joanne.carroll89@example.com";"1302618265";0;1;"Fullstack";"Karate";"Concerts";"Movies";"purus in massa tempor nec feugiat nisl pretium fusce id velit ut tortor pretium viverra suspendisse potenti nullam ac tortor vitae purus faucibus ornare suspendisse sed nisi lacus sed viverra tellus in hac habitasse platea dictumst vestibulum rhoncus est pellentesque elit ullamcorper dignissim cras tincidunt lobortis feugiat vivamus at augue.";"";0;"2019-05-27 19:43:41";"2019-05-27 19:43:41"
18;"Bernice Pearson";"1991-07-30 12:05:02";"bernice.pearson25@example.com";"1460869543";0;1;"Fullstack";"Rollercoasters";"Concerts";"Movies";"Dictum varius duis at consectetur lorem donec massa sapien faucibus et molestie ac feugiat sed lectus vestibulum mattis ullamcorper velit sed ullamcorper morbi tincidunt ornare massa eget egestas purus viverra accumsan in nisl nisi scelerisque eu ultrices vitae auctor eu augue ut lectus arcu bibendum at varius vel pharetra vel.";"";0;"2019-05-27 19:43:41";"2019-05-27 19:43:41"
19;"Judy Nichols";"1981-07-30 12:05:02";"judy.nichols87@example.com";"1645728962";0;1;"Frontend";"Cooking";"Charity Work";"Coding";"Neque vitae tempus quam pellentesque nec nam aliquam sem et tortor consequat id porta nibh venenatis cras sed felis eget velit aliquet sagittis id consectetur purus ut faucibus pulvinar elementum integer enim neque volutpat ac tincidunt vitae semper quis lectus nulla at volutpat diam ut venenatis tellus in metus vulputate.";"";0;"2019-05-27 19:43:41";"2019-05-27 19:43:41"
20;"Madison Rivera";"1983-09-18 22:05:02";"madison.rivera17@example.com";"1062096668";0;1;"Backend";"Kayaking";"Dancing";"Travelling";"ipsum dolor sit amet consectetur adipiscing elit ut aliquam purus sit amet luctus venenatis lectus magna fringilla urna porttitor rhoncus dolor purus non enim praesent elementum facilisis leo vel fringilla est ullamcorper eget nulla facilisi etiam dignissim diam quis enim lobortis scelerisque fermentum dui faucibus in ornare quam viverra orci.";"";0;"2019-05-27 19:43:41";"2019-05-27 19:43:41"
